{
  "version": 1,
  "generated_by": "boot/write_skills.py",
  "policy": {
    "selection_order": [
      "intent triggers",
      "role triggers",
      "skill triggers",
      "default files"
    ],
    "fallback_role": "debug-expert",
    "fallback_skills": [
      "api-debug",
      "fe-debug",
      "event-debug",
      "stack-start"
    ]
  },
  "intents": [
    {
      "intent": "yolo-trainer",
      "description": "分析 YOLO 训练、验证、推理和困难样本闭环，管理权重切换与模型质量。",
      "triggers": [
        "训练",
        "YOLO",
        "权重",
        "mAP",
        "过拟合",
        "欠拟合",
        "推理",
        "验证"
      ],
      "role": "yolo-trainer",
      "skills": [
        "train",
        "val",
        "infer",
        "hardcase",
        "autodl"
      ],
      "default_files": [
        "configs/model/detection_runtime.yaml",
        "data/dataset/dataset.yaml",
        "outputs/training/",
        "outputs/val/"
      ]
    },
    {
      "intent": "video-event-engineer",
      "description": "维护视频到事件、clip、材料索引的链路，定位事件漏检、误检和发布断点。",
      "triggers": [
        "事件",
        "clip",
        "materials",
        "视频处理",
        "physical_events",
        "material_stream"
      ],
      "role": "video-event-engineer",
      "skills": [
        "event-debug",
        "pipeline-run",
        "clip-check"
      ],
      "default_files": [
        "src/labsopguard/event_preprocessing/",
        "outputs/experiments/<id>/physical_events.json",
        "outputs/experiments/<id>/materials/"
      ]
    },
    {
      "intent": "step-bridge-engineer",
      "description": "维护 StepBridgeEngine、SOP 图和步骤匹配输出，解释合规判断低置信度原因。",
      "triggers": [
        "步骤",
        "SOP",
        "StepBridge",
        "合规",
        "needs_review",
        "protocol_graph"
      ],
      "role": "step-bridge-engineer",
      "skills": [
        "event-debug",
        "pipeline-run",
        "clip-check"
      ],
      "default_files": [
        "src/labsopguard/step_bridge/",
        "outputs/experiments/<id>/steps_bridge_result.json"
      ]
    },
    {
      "intent": "fastapi-backend-engineer",
      "description": "设计 FastAPI 路由、Pydantic Schema、异步任务和后端错误定位。",
      "triggers": [
        "API",
        "FastAPI",
        "路由",
        "Schema",
        "422",
        "500",
        "任务队列",
        "diagnostics"
      ],
      "role": "fastapi-backend-engineer",
      "skills": [
        "api-new",
        "api-debug",
        "stack-start",
        "pipeline-run"
      ],
      "default_files": [
        "backend/main.py",
        "src/labsopguard/workflow.py",
        "src/labsopguard/tasking.py",
        "backend_start.err.log"
      ]
    },
    {
      "intent": "vue-frontend-engineer",
      "description": "维护 Vue 组件、视频播放、API 对接、空值保护和前端调试。",
      "triggers": [
        "Vue",
        "前端",
        "白屏",
        "组件",
        "视频播放",
        "CORS",
        "resolveArtifactUrl"
      ],
      "role": "vue-frontend-engineer",
      "skills": [
        "fe-component",
        "fe-debug",
        "stack-start"
      ],
      "default_files": [
        "frontend-app/src/views/",
        "frontend-app/src/components/",
        "frontend-app/src/api/"
      ]
    },
    {
      "intent": "qwen-vlm-engineer",
      "description": "维护 DashScope/Qwen 文本与多模态调用、prompt 模板、错误处理和降级逻辑。",
      "triggers": [
        "Qwen",
        "DashScope",
        "VLM",
        "多模态",
        "prompt",
        "DASHSCOPE_API_KEY"
      ],
      "role": "qwen-vlm-engineer",
      "skills": [
        "qwen-call",
        "api-debug"
      ],
      "default_files": [
        ".env",
        "src/labsopguard/reasoning.py",
        "src/labsopguard/video_analysis.py",
        "tools/check_qwen_integration.py"
      ]
    },
    {
      "intent": "dataset-engineer",
      "description": "管理 Roboflow/YOLO 数据集、类别分布、标注质量、划分和困难样本回流。",
      "triggers": [
        "数据集",
        "Roboflow",
        "标注",
        "类别分布",
        "YOLO txt",
        "hardcase"
      ],
      "role": "dataset-engineer",
      "skills": [
        "dataset",
        "hardcase",
        "train",
        "val"
      ],
      "default_files": [
        "data/dataset/",
        "data/dataset/dataset.yaml",
        "outputs/hardcases/"
      ]
    },
    {
      "intent": "autodl-devops",
      "description": "管理 AutoDL 训练环境、数据同步、显存问题、产物下载和全栈启动。",
      "triggers": [
        "AutoDL",
        "CUDA",
        "显存",
        "scp",
        "环境",
        "启动",
        "训练服务器"
      ],
      "role": "autodl-devops",
      "skills": [
        "autodl",
        "env-new",
        "train",
        "stack-start"
      ],
      "default_files": [
        "scripts/start_full_stack.ps1",
        "outputs/training/",
        "requirements.txt",
        ".env"
      ]
    },
    {
      "intent": "debug-expert",
      "description": "跨检测、事件、API、前端和环境层做最小复现、根因定位和最小修复。",
      "triggers": [
        "报错",
        "debug",
        "traceback",
        "失败",
        "异常",
        "不可用",
        "复现"
      ],
      "role": "debug-expert",
      "skills": [
        "api-debug",
        "fe-debug",
        "event-debug",
        "clip-check",
        "stack-start"
      ],
      "default_files": [
        "backend_start.err.log",
        "frontend-app/",
        "outputs/experiments/",
        "configs/model/detection_runtime.yaml"
      ]
    },
    {
      "intent": "experiment-recorder",
      "description": "结构化记录训练、验证、对比实验、周报和可复现结论。",
      "triggers": [
        "实验记录",
        "周报",
        "训练报告",
        "复现",
        "对比",
        "结果整理"
      ],
      "role": "experiment-recorder",
      "skills": [
        "weekly",
        "train",
        "val",
        "paper-exp"
      ],
      "default_files": [
        "docs/training_report.md",
        "context/history/",
        "outputs/training/",
        "outputs/val/"
      ]
    },
    {
      "intent": "paper-engineer",
      "description": "把系统架构和实验结果转成论文方法、实验、图表和学术表达。",
      "triggers": [
        "论文",
        "方法章节",
        "实验章节",
        "LaTeX",
        "消融",
        "baseline"
      ],
      "role": "paper-engineer",
      "skills": [
        "paper-method",
        "paper-exp",
        "weekly"
      ],
      "default_files": [
        "project_brief.md",
        "docs/training_report.md",
        "outputs/val/"
      ]
    },
    {
      "intent": "vla-researcher",
      "description": "研究 LabSOPGuard 感知层到 VLA policy、闭环控制和 observation-action 数据构建。",
      "triggers": [
        "VLA",
        "具身智能",
        "闭环控制",
        "policy",
        "observation-action",
        "OpenVLA"
      ],
      "role": "vla-researcher",
      "skills": [
        "paper-method",
        "dataset",
        "event-debug"
      ],
      "default_files": [
        "project_brief.md",
        "src/labsopguard/event_preprocessing/",
        "data/dataset/"
      ]
    },
    {
      "intent": "system-architect",
      "description": "设计新模块、接口契约、目录结构和依赖边界，避免循环依赖。",
      "triggers": [
        "架构",
        "新模块",
        "接口",
        "目录结构",
        "依赖",
        "重构",
        "新项目"
      ],
      "role": "system-architect",
      "skills": [
        "api-new",
        "env-new",
        "stack-start",
        "pipeline-run",
        "paper-method"
      ],
      "default_files": [
        "README.md",
        "src/labsopguard/",
        "backend/main.py",
        "frontend-app/src/"
      ]
    },
    {
      "intent": "ppt-coach",
      "description": "拆解汇报逻辑、页面结构、核心卖点、演讲提示和评委问题。",
      "triggers": [
        "PPT",
        "答辩",
        "汇报",
        "开题",
        "毕业设计",
        "演讲",
        "评委问题"
      ],
      "role": "ppt-coach",
      "skills": [
        "ppt-outline",
        "weekly",
        "paper-exp"
      ],
      "default_files": [
        "project_brief.md",
        "docs/training_report.md",
        "context/active_focus.md"
      ]
    }
  ],
  "roles": {
    "yolo-trainer": {
      "id": "01",
      "name": "YOLO 训练专家",
      "category": "detection",
      "description": "分析 YOLO 训练、验证、推理和困难样本闭环，管理权重切换与模型质量。",
      "triggers": [
        "训练",
        "YOLO",
        "权重",
        "mAP",
        "过拟合",
        "欠拟合",
        "推理",
        "验证"
      ],
      "skills": [
        "train",
        "val",
        "infer",
        "hardcase",
        "autodl"
      ],
      "default_files": [
        "configs/model/detection_runtime.yaml",
        "data/dataset/dataset.yaml",
        "outputs/training/",
        "outputs/val/"
      ]
    },
    "video-event-engineer": {
      "id": "02",
      "name": "视频事件检测工程师",
      "category": "pipeline",
      "description": "维护视频到事件、clip、材料索引的链路，定位事件漏检、误检和发布断点。",
      "triggers": [
        "事件",
        "clip",
        "materials",
        "视频处理",
        "physical_events",
        "material_stream"
      ],
      "skills": [
        "event-debug",
        "pipeline-run",
        "clip-check"
      ],
      "default_files": [
        "src/labsopguard/event_preprocessing/",
        "outputs/experiments/<id>/physical_events.json",
        "outputs/experiments/<id>/materials/"
      ]
    },
    "step-bridge-engineer": {
      "id": "03",
      "name": "步骤推理工程师",
      "category": "pipeline",
      "description": "维护 StepBridgeEngine、SOP 图和步骤匹配输出，解释合规判断低置信度原因。",
      "triggers": [
        "步骤",
        "SOP",
        "StepBridge",
        "合规",
        "needs_review",
        "protocol_graph"
      ],
      "skills": [
        "event-debug",
        "pipeline-run",
        "clip-check"
      ],
      "default_files": [
        "src/labsopguard/step_bridge/",
        "outputs/experiments/<id>/steps_bridge_result.json"
      ]
    },
    "fastapi-backend-engineer": {
      "id": "04",
      "name": "FastAPI 后端工程师",
      "category": "backend",
      "description": "设计 FastAPI 路由、Pydantic Schema、异步任务和后端错误定位。",
      "triggers": [
        "API",
        "FastAPI",
        "路由",
        "Schema",
        "422",
        "500",
        "任务队列",
        "diagnostics"
      ],
      "skills": [
        "api-new",
        "api-debug",